Grade,Topic,Subtopic,Activity Type,Activity Name,Description,Location
Class 5,Vocabulary,New Words,Practice,Find New Words within Longer Words,Students practice recognising new words by finding shorter words in them.,english/content/language_arts/DR1_en-IN/dr1/dr1/cm/launch.html?../PC/OnStage/x_a574.swf
Class 5,Grammar,Nouns,Instruction,The Noun Song,A song explaining that nouns are names of people? places? animals or things.,english/content/language_arts/DR1_en-IN/dr1/dr1/cm/launch.html?../PC/Song/x_a410.swf
Class 5,Grammar,Nouns,Instruction,Proper Nouns: Introduction,An introduction to proper nouns.,english/content/language_arts/DR1_en-IN/dr1/dr1/cm/launch.html?../PC/OnStage/x_a770.swf
Class 5,Grammar,Nouns,Practice,Identify Proper Nouns 1,Students identify proper nouns in a passage.,english/content/language_arts/DR1_en-IN/dr1/dr1/cm/launch.html?../DD/FW/x_a771.swf
Class 5,Grammar,Nouns,Practice,Identify Proper Nouns 2,Students identify proper nouns in a passage.,english/content/language_arts/DR1_en-IN/dr1/dr1/cm/launch.html?../DD/FW/x_a796.swf
Class 5,Grammar,Nouns,Instruction,Possessive Nouns: Introduction,An introduction to possessive nouns.,english/content/language_arts/DR1_en-IN/dr1/dr1/cm/launch.html?../PC/OnStage/x_a281.swf
Class 5,Grammar,Nouns,Practice,Identify Possessive Nouns,Students identify possessive nouns in a passage.,english/content/language_arts/DR1_en-IN/dr1/dr1/cm/launch.html?../DD/FW/x_a293.swf
Class 5,Grammar,Nouns,Instruction,Words Beginning with Capital Letters on Stage,An introduction to why some words begin with capital letters.,english/content/language_arts/DR1_en-IN/dr1/dr1/cm/launch.html?../PC/OnStage/x_a425.swf
Class 5,Grammar,Singular and Plural,Practice,Match Singular and Plurals 1,Students match singular nouns with their plurals.,english/content/language_arts/DR1_en-IN/dr1/dr1/cm/launch.html?../PC/HollyWPairs/r616/x_a616.swf
Class 5,Grammar,Singular and Plural,Practice,Match Singular and Plurals 2,A game in which students match words with their plurals.,english/content/language_arts/DR1_en-IN/dr1/dr1/cm/launch.html?../PC/HollyWPairs/r620/x_a620.swf
Class 5,Grammar,Pronouns,Instruction,Pronouns: Introduction,An introduction to pronouns.,english/content/language_arts/DR1_en-IN/dr1/dr1/cm/launch.html?../PC/OnStage/x_a496.swf
Class 5,Grammar,Pronouns,Practice,Identify Pronouns,Students identify pronouns in a passage.,english/content/language_arts/DR1_en-IN/dr1/dr1/cm/launch.html?../DD/FW/x_a593.swf
Class 5,Grammar,Verbs,Instruction,Verbs: Introduction,An introduction to action words or verbs.,english/content/language_arts/DR1_en-IN/dr1/dr1/cm/launch.html?../PC/Song/x_a419.swf
Class 5,Grammar,Verbs,Practice,Complete the Sentence: Verbs,Students choose the correct verbs to complete sentences.,english/content/language_arts/DR1_en-IN/dr1/dr1/cm/launch.html?../DD/CP/x_a285.swf
Class 5,Grammar,Verbs,Practice,Complete the Sentence: Irregular Verbs: Past and Present Forms,Students use irregular verbs to complete sentences.,english/content/language_arts/DR1_en-IN/dr1/dr1/cm/launch.html?../DD/CP/x_a288.swf
Class 5,Grammar,Subject- Verb Agreement,Instruction,Subject-Verb Agreement A,An introduction to subject-verb agreement.,english/content/language_arts/DR1_en-IN/dr1/dr1/cm/launch.html?../PC/OnStage/x_a282.swf
Class 5,Grammar,Subject- Verb Agreement,Practice,Identify Sentences with Correct Subject-Verb Agreement 1,Students identify sentences in which the subject agrees with the verb.,english/content/language_arts/DR1_en-IN/dr1/dr1/cm/launch.html?../PC/ChoiceIsRight/r292/x_a292.swf
Class 5,Grammar,Subject- Verb Agreement,Practice,Identify Sentences with Correct Subject-Verb Agreement 2,Students choose sentences in which subject and verb agree.,english/content/language_arts/DR1_en-IN/dr1/dr1/cm/launch.html?../PC/ChoiceIsRight/r570/x_a570.swf
Class 5,Grammar,Punctuations,Practice,Match the Contractions 1,A game in which students match pairs of words with contractions of those words.,english/content/language_arts/DR1_en-IN/dr1/dr1/cm/launch.html?../PC/HollyWPairs/r543/x_a543.swf
Class 5,Grammar,Punctuations,Practice,Match the Contractions 2,A game in which students match words with their contractions.,english/content/language_arts/DR1_en-IN/dr1/dr1/cm/launch.html?../PC/HollyWPairs/r798/x_a798.swf
Class 5,Grammar,Punctuations,Practice,Match the Abbreviations 1,A game in which students match words with their abbreviations.,english/content/language_arts/DR2_en-IN/dr2/dr2/cm/launch.html?../PC/HollyWPairs/r773/x_a773.swf
Class 5,Grammar,Punctuations,Practice,Match the Abbreviations 2,A game in which students match words with their abbreviations.,english/content/language_arts/DR1_en-IN/dr1/dr1/cm/launch.html?../PC/HollyWPairs/r794/x_a794.swf
Class 5,Grammar,Punctuations,Instruction,End of Sentence Punctuation,An introduction to end-of-sentence punctuation marks in different types of sentences.,english/content/language_arts/DR1_en-IN/dr1/dr1/cm/launch.html?../PC/OnStage/x_a409.swf
Class 5,Grammar,Punctuations,Practice,Identify Sentences with Lists,Students identify sentences with lists.,english/content/language_arts/DR1_en-IN/dr1/dr1/cm/launch.html?../DD/FW/x_a778.swf
Class 5,Grammar,Adjectives,Instruction,Adjectives: Introduction 2,A dialogue that uses adjectives to describe a lizard.,english/content/language_arts/DR1_en-IN/dr1/dr1/cm/launch.html?../PC/Song/x_a785.swf
Class 5,Grammar,Adjectives,Instruction,Adjectives: Introduction 2,A dialogue that uses adjectives to describe a lizard.,english/content/language_arts/DR1_en-IN/dr1/dr1/cm/launch.html?../PC/Song/x_a785.swf
Class 5,Grammar,Adjectives,Practice,Complete the Sentence: Nouns and Adjectives,Students use nouns and adjectives to complete sentences.,english/content/language_arts/DR1_en-IN/dr1/dr1/cm/launch.html?../DD/CP/x_a412.swf
Class 5,Grammar,Sentences,Practice,Compound Words in Sentences,Students explore how different compound words can change the meaning of sentences.,english/content/language_arts/DR1_en-IN/dr1/dr1/cm/launch.html?../PC/SillySentences/x_a628.swf
Class 5,Grammar,Conjunctions,Instruction,Conjunctions- and? or? and but: Conjunctions,An introduction to the conjunctions and? or and but.,english/content/language_arts/DR1_en-IN/dr1/dr1/cm/launch.html?../PC/OnStage/x_a422.swf
Class 5,Grammar,Conjunctions,Practice,Identify Conjunctions- and? or? and but,Students identify conjunctions in sentences.,english/content/language_arts/DR1_en-IN/dr1/dr1/cm/launch.html?../DD/FW/x_a428.swf
Class 5,Grammar,Adverbs,Practice,The Adverb Song,A rhyme about adverbs.,english/content/language_arts/DR1_en-IN/dr1/dr1/cm/launch.html?../PC/Song/x_a623.swf
Class 5,Grammar,Adverbs,Practice,Identify Verbs and Adverbs,Students identify verbs and adverbs in a passage.,english/content/language_arts/DR1_en-IN/dr1/dr1/cm/launch.html?../DD/FW/x_a429.swf
